{
  "tool" : {
    "version" : "<version>",
    "matrixVersion" : "<version>"
  },
  "bind" : "127.0.0.1:<port>",
  "networkMode" : "isolated",
  "lastRun" : null,
  "lock" : {
    "held" : false
  },
  "pendingRuns" : [ ],
  "snapshots" : {
    "count" : 0,
    "bytes" : 0,
    "retentionDays" : 30
  }
}
